album_name,track_title,track_n,lyric,line
evermore (deluxe version),​happiness,7,But there was happiness because of you,10
evermore (deluxe version),​happiness,7,Both of these things can be true,11
evermore (deluxe version),​happiness,7,There is happiness,12
evermore (deluxe version),​happiness,7,Past the blood and bruise,13
evermore (deluxe version),​happiness,7,Past the curses and cries,14
evermore (deluxe version),​happiness,7,Beyond the terror in the nightfall,15
evermore (deluxe version),​happiness,7,Haunted by the look in my eyes,16
evermore (deluxe version),​happiness,7,That would've loved you for a lifetime,17
evermore (deluxe version),​happiness,7,Leave it all behind,18
evermore (deluxe version),​happiness,7,And there is happiness,19
evermore (deluxe version),​happiness,7,"Tell me, when did your winning smile",20
evermore (deluxe version),​happiness,7,Begin to look like a smirk?,21
evermore (deluxe version),​happiness,7,When did all our lessons start to look like weapons,22
evermore (deluxe version),​happiness,7,Pointed at my deepest hurt?,23
evermore (deluxe version),​happiness,7,I hope she'll be a beautiful fool,24
evermore (deluxe version),​happiness,7,Who takes my spot next to you,25
evermore (deluxe version),​happiness,7,"No, I didn't mean that",26
evermore (deluxe version),​happiness,7,"Sorry, I can't see facts through all of my fury",27
evermore (deluxe version),​happiness,7,You haven't met the new me yet,28
evermore (deluxe version),​happiness,7,Joeboy 'Sip (Alcohol)' Official Lyrics & Meaning | Verified,29
evermore (deluxe version),​happiness,7,There'll be happiness after me,30
evermore (deluxe version),​happiness,7,But there was happiness because of me,31
evermore (deluxe version),​happiness,7,"Both of these things, I believe",32
evermore (deluxe version),​happiness,7,There is happiness,33
evermore (deluxe version),​happiness,7,"In our history, across our great divide",34
evermore (deluxe version),​happiness,7,There is a glorious sunrise,35
evermore (deluxe version),​happiness,7,Dappled with the flickers of light,36
evermore (deluxe version),​happiness,7,"From the dress I wore at midnight, leave it all behind",37
evermore (deluxe version),​happiness,7,And there is happiness,38
evermore (deluxe version),​happiness,7,I can't make it go away by making you a villain,39
evermore (deluxe version),​happiness,7,I guess it's the price I paid for seven years in Heaven,40
evermore (deluxe version),​happiness,7,And I pulled your body into mine,41
evermore (deluxe version),​happiness,7,"Every goddamn night, now I get fake niceties",42
evermore (deluxe version),​happiness,7,No one teaches you what to do,43
evermore (deluxe version),​happiness,7,When a good man hurts you,44
evermore (deluxe version),​happiness,7,And you know you hurt him too,45
evermore (deluxe version),​happiness,7,"Honey, when I'm above the trees",46
evermore (deluxe version),​happiness,7,I see it for what it is,47
evermore (deluxe version),​happiness,7,But now my eyes leak acid rain on the pillow where you used to lay your head,48
evermore (deluxe version),​happiness,7,After giving you the best I had,49
evermore (deluxe version),​happiness,7,Tell me what to give after that,50
evermore (deluxe version),​happiness,7,All you want from me now is the green light of forgiveness,51
evermore (deluxe version),​happiness,7,You haven't met the new me yet,52
evermore (deluxe version),​happiness,7,And I think she'll give you that,53
evermore (deluxe version),​happiness,7,There'll be happiness after you,54
evermore (deluxe version),​happiness,7,But there was happiness because of you too,55
evermore (deluxe version),​happiness,7,Both of these things can be true,56
evermore (deluxe version),​happiness,7,There is happiness,57
evermore (deluxe version),​happiness,7,"In our history, across our great divide",58
evermore (deluxe version),​happiness,7,There is a glorious sunrise,59
evermore (deluxe version),​happiness,7,Dappled with the flickers of light,60
evermore (deluxe version),​happiness,7,"From the dress I wore at midnight, leave it all behind",61
evermore (deluxe version),​happiness,7,"Oh, leave it all behind",62
evermore (deluxe version),​happiness,7,Leave it all behind,63
evermore (deluxe version),​happiness,7,And there is happiness,64
evermore (deluxe version),​dorothea,8,"Hey, Dorothea, do you ever stop and think about me?",1
evermore (deluxe version),​dorothea,8,When we were younger down in the park,2
evermore (deluxe version),​dorothea,8,"Honey, making a lark of the misery",3
evermore (deluxe version),​dorothea,8,You got shiny friends since you left town,4
evermore (deluxe version),​dorothea,8,A tiny screen's the only place I see you now,5
evermore (deluxe version),​dorothea,8,And I got nothing but well wishes for ya,6
evermore (deluxe version),​dorothea,8,"Ooh, this place is the same as it ever was",7
evermore (deluxe version),​dorothea,8,"Ooh, but you won't like it that way",8
evermore (deluxe version),​dorothea,8,It's never too late to come back to my side,9
evermore (deluxe version),​dorothea,8,The stars in your eyes shined brighter in Tupelo,10
evermore (deluxe version),​dorothea,8,And if you're ever tired of bеing known for who you know,11
evermore (deluxe version),​dorothea,8,"You know that you'll always know me, Dorothea (Uh-uh)",12
evermore (deluxe version),​dorothea,8,Dorothea (Ah-ah),13
evermore (deluxe version),​dorothea,8,"Ooh, you'rе a queen sellin' dreams, sellin' makeup and magazines",14
evermore (deluxe version),​dorothea,8,"Ooh, from you, I'd buy anything",15
evermore (deluxe version),​dorothea,8,"Hey, Dorothea, do you ever stop and think about me?",16
evermore (deluxe version),​dorothea,8,"When it was calmer, skipping the prom just to piss off your mom and her pageant schemes",17
evermore (deluxe version),​dorothea,8,"And damn, Dorothea, they all wanna be ya",18
evermore (deluxe version),​dorothea,8,But are you still the same soul I met under the bleachers? Well,19
evermore (deluxe version),​dorothea,8,"Ooh, I guess I'll never know",20
evermore (deluxe version),​dorothea,8,"Ooh, and you'll go on with the show",21
evermore (deluxe version),​dorothea,8,But it's never too late to come back to my side,22
evermore (deluxe version),​dorothea,8,The stars in your eyes shined brighter in Tupelo,23
evermore (deluxe version),​dorothea,8,And if you're ever tired of being known for who you know,24
evermore (deluxe version),​dorothea,8,"You know, you'll always know me, Dorothea (Uh-uh)",25
evermore (deluxe version),​dorothea,8,Dorothea (Ah-ah),26
evermore (deluxe version),​dorothea,8,"Ooh, ooh",27
evermore (deluxe version),​dorothea,8,"Ooh-woo-ooh-ooh-ooh, ooh-ooh-ooh-ooh",28
evermore (deluxe version),​dorothea,8,"Ooh, ooh",29
evermore (deluxe version),​dorothea,8,"Ooh-woo-ooh-ooh-ooh, ooh-ooh-ooh",30
evermore (deluxe version),​dorothea,8,Dorothea (Ah-ah-ah),31
evermore (deluxe version),​dorothea,8,Ah-ah,32
evermore (deluxe version),​dorothea,8,Ooh,33
evermore (deluxe version),​coney island,9,Break my soul in two looking for you,1
evermore (deluxe version),​coney island,9,But you're right here,2
evermore (deluxe version),​coney island,9,If I can't relate to you anymore,3
evermore (deluxe version),​coney island,9,Then who am I related to?,4
evermore (deluxe version),​coney island,9,And if this is the long haul,5
evermore (deluxe version),​coney island,9,How'd we get here so soon?,6
evermore (deluxe version),​coney island,9,Did I close my fist around something delicate?,7
evermore (deluxe version),​coney island,9,Did I shatter you?,8
evermore (deluxe version),​coney island,9,And I'm sitting on a bench in Coney Island,9
evermore (deluxe version),​coney island,9,Wondering where did my baby go?,10
evermore (deluxe version),​coney island,9,"The fast times, the bright lights, the merry go",11
evermore (deluxe version),​coney island,9,Sorry for not making you my centerfold,12
evermore (deluxe version),​coney island,9,Over and over,13
evermore (deluxe version),​coney island,9,Lost again with no surprises,14
evermore (deluxe version),​coney island,9,"Disappointments, close your eyes",15
evermore (deluxe version),​coney island,9,And it gets colder and colder,16
evermore (deluxe version),​coney island,9,When the sun goes down,17
evermore (deluxe version),​coney island,9,The question pounds my head,18
evermore (deluxe version),​coney island,9,What's a lifetime of achievement,19
evermore (deluxe version),​coney island,9,If I pushed you to the edge?,20
evermore (deluxe version),​coney island,9,But you were too polite to leave me,21
evermore (deluxe version),​coney island,9,And do you miss the rogue,22
evermore (deluxe version),​coney island,9,Who coaxed you into paradise and left you there?,23
evermore (deluxe version),​coney island,9,Will you forgive my soul,24
evermore (deluxe version),​coney island,9,When you're too wise to trust me and too old to care?,25
evermore (deluxe version),​coney island,9,'Cause we were like the mall before the internet,26
evermore (deluxe version),​coney island,9,It was the one place to be,27
evermore (deluxe version),​coney island,9,"The mischief, the gift-wrapped suburban dreams",28
evermore (deluxe version),​coney island,9,Sorry for not winning you an arcade ring,29
evermore (deluxe version),​coney island,9,Over and over,30
evermore (deluxe version),​coney island,9,Lost again with no surprises,31
evermore (deluxe version),​coney island,9,"Disappointments, close your eyes",32
evermore (deluxe version),​coney island,9,And it gets colder and colder,33
evermore (deluxe version),​coney island,9,When the sun goes down,34
evermore (deluxe version),​coney island,9,Were you waiting at our old spot,35
evermore (deluxe version),​coney island,9,In the tree line,36
evermore (deluxe version),​coney island,9,By the gold clock,37
evermore (deluxe version),​coney island,9,Did I leave you hanging every single day?,38
evermore (deluxe version),​coney island,9,Were you standing in the hallway,39
evermore (deluxe version),​coney island,9,"With a big cake, happy birthday",40
evermore (deluxe version),​coney island,9,Did I paint your bluest skies the darkest grey?,41
evermore (deluxe version),​coney island,9,A universe away,42
evermore (deluxe version),​coney island,9,And when I got into the accident,43
evermore (deluxe version),​coney island,9,The sight that flashed before me was your face,44
evermore (deluxe version),​coney island,9,"But when I walked up to the podium, I think that I forgot to say your name",45
evermore (deluxe version),​coney island,9,I'm on a bench in Coney Island,46
evermore (deluxe version),​coney island,9,Wondering where did my baby go?,47
evermore (deluxe version),​coney island,9,"The fast times, the bright lights, the merry go",48
evermore (deluxe version),​coney island,9,Sorry for not making you my centerfold,49
evermore (deluxe version),​coney island,9,Over and over,50
evermore (deluxe version),​coney island,9,Lost again with no surprises,51
evermore (deluxe version),​coney island,9,"Disappointments, close your eyes",52
evermore (deluxe version),​coney island,9,And it gets colder and colder,53
evermore (deluxe version),​coney island,9,When the sun goes down,54
evermore (deluxe version),​coney island,9,When the sun goes down,55
evermore (deluxe version),​coney island,9,The sight that flashed before me was your face,56
evermore (deluxe version),​coney island,9,When the sun goes down,57
evermore (deluxe version),​coney island,9,But I think that I forgot to say your name,58
evermore (deluxe version),​coney island,9,Over and over,59
evermore (deluxe version),​coney island,9,"Sorry for not making you my, making you my",60
evermore (deluxe version),​coney island,9,Making you my centerfold,61
evermore (deluxe version),​ivy,10,How's one to know?,1
evermore (deluxe version),​ivy,10,I'd meet you where the spirit meets the bones,2
evermore (deluxe version),​ivy,10,In a faith-forgotten land,3
evermore (deluxe version),​ivy,10,In from the snow,4
evermore (deluxe version),​ivy,10,Your touch brought forth an incandescent glow,5
evermore (deluxe version),​ivy,10,Tarnished but so grand,6
evermore (deluxe version),​ivy,10,And the old widow goes to the stone every day,7
evermore (deluxe version),​ivy,10,"But I don't, I just sit here and wait",8
evermore (deluxe version),​ivy,10,Grieving for the living,9
evermore (deluxe version),​ivy,10,"Oh, goddamn",10
evermore (deluxe version),​ivy,10,My pain fits in the palm of your freezing hand,11
evermore (deluxe version),​ivy,10,"Taking mine, but it's been promised to another",12
evermore (deluxe version),​ivy,10,"Oh, I can't",13
evermore (deluxe version),​ivy,10,Stop you putting roots in my dreamland,14
evermore (deluxe version),​ivy,10,"My house of stone, your ivy grows",15
evermore (deluxe version),​ivy,10,And now I'm covered in you,16
evermore (deluxe version),​ivy,10,I wish to know,17
evermore (deluxe version),​ivy,10,The fatal flaw that makes you long to be,18
evermore (deluxe version),​ivy,10,Magnificently cursed,19
evermore (deluxe version),​ivy,10,He's in the room,20
evermore (deluxe version),​ivy,10,Your opal eyes are all I wish to see,21
evermore (deluxe version),​ivy,10,He wants what's only yours,22
evermore (deluxe version),​ivy,10,"Oh, goddamn",23
evermore (deluxe version),​ivy,10,My pain fits in the palm of your freezing hand,24
evermore (deluxe version),​ivy,10,"Taking mine, but it's been promised to another",25
evermore (deluxe version),​ivy,10,"Oh, I can't",26
evermore (deluxe version),​ivy,10,Stop you putting roots in my dreamland,27
evermore (deluxe version),​ivy,10,"My house of stone, your ivy grows",28
evermore (deluxe version),​ivy,10,And now I'm covered,29
evermore (deluxe version),​ivy,10,Clover blooms in the fields,30
evermore (deluxe version),​ivy,10,"Spring breaks loose, the time is near",31
evermore (deluxe version),​ivy,10,What would he do if he found us out?,32
evermore (deluxe version),​ivy,10,"Crescent moon, coast is clear",33
evermore (deluxe version),​ivy,10,"Spring breaks loose, but so does fear",34
evermore (deluxe version),​ivy,10,He's gonna burn this house to the ground,35
evermore (deluxe version),​ivy,10,How's one to know?,36
evermore (deluxe version),​ivy,10,I'd live and die for moments that we stole,37
evermore (deluxe version),​ivy,10,On begged and borrowed time,38
evermore (deluxe version),​ivy,10,So tell me to run,39
evermore (deluxe version),​ivy,10,Or dare to sit and watch what we'll become,40
evermore (deluxe version),​ivy,10,And drink my husband's wine,41
evermore (deluxe version),​ivy,10,"Oh, goddamn",42
evermore (deluxe version),​ivy,10,My pain fits in the palm of your freezing hand,43
evermore (deluxe version),​ivy,10,"Taking mine, but it's been promised to another",44
evermore (deluxe version),​ivy,10,"Oh, I can't",45
evermore (deluxe version),​ivy,10,Stop you putting roots in my dreamland,46
evermore (deluxe version),​ivy,10,"My house of stone, your ivy grows",47
evermore (deluxe version),​ivy,10,And now I'm covered in you,48
evermore (deluxe version),​ivy,10,And I'm covered in you,49
evermore (deluxe version),​ivy,10,"So yeah, it's a fire",50
evermore (deluxe version),​ivy,10,It's a goddamn blaze in the dark,51
evermore (deluxe version),​ivy,10,And you started it,52
evermore (deluxe version),​ivy,10,You started it,53
evermore (deluxe version),​ivy,10,"So yeah, it's a war",54
evermore (deluxe version),​ivy,10,It's the goddamn fight of my life,55
evermore (deluxe version),​ivy,10,And you started it,56
evermore (deluxe version),​ivy,10,You started it,57
evermore (deluxe version),​ivy,10,"Oh, I can't",58
evermore (deluxe version),​ivy,10,Stop you putting roots in my dreamland,59
evermore (deluxe version),​ivy,10,"My house of stone, your ivy grows",60
evermore (deluxe version),​ivy,10,And now I'm covered,61
evermore (deluxe version),​ivy,10,"In you, in you",62
evermore (deluxe version),​ivy,10,Now I'm covered in you,63
evermore (deluxe version),​ivy,10,In you,64
evermore (deluxe version),cowboy like me,11,And the tennis court was covered up,1
evermore (deluxe version),cowboy like me,11,With some tent-like thing,2
evermore (deluxe version),cowboy like me,11,And you asked me to dance,3
evermore (deluxe version),cowboy like me,11,"But I said, ""Dancin' is a dangerous game""",4
evermore (deluxe version),cowboy like me,11,"Oh, I thought",5
evermore (deluxe version),cowboy like me,11,This is gonna be one of those things,6
evermore (deluxe version),cowboy like me,11,Now I know,7
evermore (deluxe version),cowboy like me,11,I'm never gonna love again,8
evermore (deluxe version),cowboy like me,11,I've got some tricks up my sleeve,9
evermore (deluxe version),cowboy like me,11,Takes one to know one,10
evermore (deluxe version),cowboy like me,11,You're a cowboy like me,11
evermore (deluxe version),cowboy like me,11,Never wanted love,12
evermore (deluxe version),cowboy like me,11,Just a fancy car,13
evermore (deluxe version),cowboy like me,11,Now I'm waiting by the phone,14
evermore (deluxe version),cowboy like me,11,Like I'm sitting in an airport bar,15
evermore (deluxe version),cowboy like me,11,You had some tricks up your sleeve,16
evermore (deluxe version),cowboy like me,11,Takes one to know one,17
evermore (deluxe version),cowboy like me,11,You're a cowboy like me,18
evermore (deluxe version),cowboy like me,11,Perched in the dark,19
evermore (deluxe version),cowboy like me,11,Telling all the rich folks anything they wanna hear,20
evermore (deluxe version),cowboy like me,11,Like it could be love,21
evermore (deluxe version),cowboy like me,11,I could be the way forward,22
evermore (deluxe version),cowboy like me,11,Only if they pay for it,23
evermore (deluxe version),cowboy like me,11,You're a bandit like me,24
evermore (deluxe version),cowboy like me,11,Eyes full of stars,25
evermore (deluxe version),cowboy like me,11,Hustling for the good life,26
evermore (deluxe version),cowboy like me,11,Never thought I'd meet you here,27
evermore (deluxe version),cowboy like me,11,It could be love,28
evermore (deluxe version),cowboy like me,11,We could be the way forward,29
evermore (deluxe version),cowboy like me,11,And I know I'll pay for it,30
evermore (deluxe version),cowboy like me,11,You're a cowboy like me,31
evermore (deluxe version),cowboy like me,11,Perched in the dark,32
evermore (deluxe version),cowboy like me,11,Telling all the rich folks anything they wanna hear,33
evermore (deluxe version),cowboy like me,11,Like it could be love,34
evermore (deluxe version),cowboy like me,11,I could be the way forward,35
evermore (deluxe version),cowboy like me,11,Only if they pay for it,36
evermore (deluxe version),cowboy like me,11,You're a bandit like me,37
evermore (deluxe version),cowboy like me,11,Eyes full of stars,38
evermore (deluxe version),cowboy like me,11,Hustling for the good life,39
evermore (deluxe version),cowboy like me,11,Never thought I'd meet you here,40
evermore (deluxe version),cowboy like me,11,It could be love,41
evermore (deluxe version),cowboy like me,11,We could be the way forward,42
evermore (deluxe version),cowboy like me,11,And I know I'll pay for it,43
evermore (deluxe version),cowboy like me,11,And the skeletons in both our closets,44
evermore (deluxe version),cowboy like me,11,Plotted hard to fuck this up,45
evermore (deluxe version),cowboy like me,11,And the old men that I've swindled,46
evermore (deluxe version),cowboy like me,11,Really did believe I was the one,47
evermore (deluxe version),cowboy like me,11,And the ladies lunching have their stories about,48
evermore (deluxe version),cowboy like me,11,When you passed through town,49
evermore (deluxe version),cowboy like me,11,But that was all before I locked it down,50
evermore (deluxe version),cowboy like me,11,Now you hang from my lips,51
evermore (deluxe version),cowboy like me,11,Like the Gardens of Babylon,52
evermore (deluxe version),cowboy like me,11,With your boots beneath my bed,53
evermore (deluxe version),cowboy like me,11,Forever is the sweetest con,54
evermore (deluxe version),cowboy like me,11,I've had some tricks up my sleeve,55
evermore (deluxe version),cowboy like me,11,Takes one to know one,56
evermore (deluxe version),cowboy like me,11,You're a cowboy like me,57
evermore (deluxe version),cowboy like me,11,And I'm never gonna love again,58
evermore (deluxe version),cowboy like me,11,I'm never gonna love again,59
evermore (deluxe version),cowboy like me,11,I'm never gonna love again,60
evermore (deluxe version),​l​ong story short,12,Fatefully,1
evermore (deluxe version),​l​ong story short,12,I tried to pick my battles 'til the battle picked me,2
evermore (deluxe version),​l​ong story short,12,Misery,3
evermore (deluxe version),​l​ong story short,12,Like the war of words I shouted in my sleep,4
evermore (deluxe version),​l​ong story short,12,And you passed right by,5
evermore (deluxe version),​l​ong story short,12,"I was in the alley, surrounded on all sides",6
evermore (deluxe version),​l​ong story short,12,The knife cuts both ways,7
evermore (deluxe version),​l​ong story short,12,"If the shoe fits, walk in it 'til your high heels break",8
evermore (deluxe version),​l​ong story short,12,And I fell from the pedestal,9
evermore (deluxe version),​l​ong story short,12,Right down the rabbit hole,10
evermore (deluxe version),​l​ong story short,12,"Long story short, it was a bad time",11
evermore (deluxe version),​l​ong story short,12,Pushed from the precipice,12
evermore (deluxe version),​l​ong story short,12,Clung to the nearest lips,13
evermore (deluxe version),​l​ong story short,12,"Long story short, it was the wrong guy",14
evermore (deluxe version),​l​ong story short,12,Now I'm all about you,15
evermore (deluxe version),​l​ong story short,12,"I'm all about you, ah",16
evermore (deluxe version),​l​ong story short,12,"Yeah, yeah",17
evermore (deluxe version),​l​ong story short,12,"I'm all about you, ah",18
evermore (deluxe version),​l​ong story short,12,"Yeah, yeah",19
evermore (deluxe version),​l​ong story short,12,Actually,20
evermore (deluxe version),​l​ong story short,12,I always felt I must look better in the rear view,21
evermore (deluxe version),​l​ong story short,12,Missing me,22
evermore (deluxe version),​l​ong story short,12,At the golden gates they once held the keys to,23
evermore (deluxe version),​l​ong story short,12,When I dropped my sword,24
evermore (deluxe version),​l​ong story short,12,I threw it in the bushes and knocked on your door,25
evermore (deluxe version),​l​ong story short,12,And we live in peace,26
evermore (deluxe version),​l​ong story short,12,"But if someone comes at us, this time, I'm ready",27
evermore (deluxe version),​l​ong story short,12,'Cause I fell from the pedestal,28
evermore (deluxe version),​l​ong story short,12,Right down the rabbit hole,29
evermore (deluxe version),​l​ong story short,12,"Long story short, it was a bad time",30
evermore (deluxe version),​l​ong story short,12,Pushed from the precipice,31
evermore (deluxe version),​l​ong story short,12,Clung to the nearest lips,32
evermore (deluxe version),​l​ong story short,12,"Long story short, it was the wrong guy",33
evermore (deluxe version),​l​ong story short,12,Now I'm all about you,34
evermore (deluxe version),​l​ong story short,12,"I'm all about you, ah",35
evermore (deluxe version),​l​ong story short,12,"Yeah, yeah",36
evermore (deluxe version),​l​ong story short,12,I'm all about you,37
evermore (deluxe version),​l​ong story short,12,No more keepin' score,38
evermore (deluxe version),​l​ong story short,12,Now I just keep you warm (Keep you warm),39
evermore (deluxe version),​l​ong story short,12,No more tug of war,40
evermore (deluxe version),​l​ong story short,12,Now I just know there's more (Know there's more),41
evermore (deluxe version),​l​ong story short,12,No more keepin' score,42
evermore (deluxe version),​l​ong story short,12,Now I just keep you warm (Keep you warm),43
evermore (deluxe version),​l​ong story short,12,And my waves meet your shore,44
evermore (deluxe version),​l​ong story short,12,Ever and evermore,45
evermore (deluxe version),​l​ong story short,12,Past me,46
evermore (deluxe version),​l​ong story short,12,I wanna tell you not to get lost in these petty things,47
evermore (deluxe version),​l​ong story short,12,Your nemeses,48
evermore (deluxe version),​l​ong story short,12,Will defeat themselves before you get the chance to swing,49
evermore (deluxe version),​l​ong story short,12,And he's passing by,50
evermore (deluxe version),​l​ong story short,12,Rare as the glimmer of a comet in the sky,51
evermore (deluxe version),​l​ong story short,12,And he feels like home,52
evermore (deluxe version),​l​ong story short,12,"If the shoe fits, walk in it everywhere you go",53
evermore (deluxe version),​l​ong story short,12,And I fell from the pedestal,54
evermore (deluxe version),​l​ong story short,12,Right down the rabbit hole,55
evermore (deluxe version),​l​ong story short,12,"Long story short, it was a bad time",56
