album_name,track_title,track_n,lyric,line
evermore (deluxe version),willow,1,I'm like the water when your ship rolled in that night,1
evermore (deluxe version),willow,1,"Rough on the surface, but you cut through like a knife",2
evermore (deluxe version),willow,1,And if it was an open-shut case,3
evermore (deluxe version),willow,1,I never would've known from that look on your face,4
evermore (deluxe version),willow,1,Lost in your current like a priceless wine,5
evermore (deluxe version),willow,1,"The more that you say, the less I know",6
evermore (deluxe version),willow,1,"Wherever you stray, I follow",7
evermore (deluxe version),willow,1,I'm begging for you to take my hand,8
evermore (deluxe version),willow,1,"Wreck my plans, that's my man",9
evermore (deluxe version),willow,1,Life was a willow and it bent right to your wind,10
evermore (deluxe version),willow,1,"Head on the pillow, I could feel you sneakin' in",11
evermore (deluxe version),willow,1,As if you were a mythical thing,12
evermore (deluxe version),willow,1,Like you were a trophy or a champion ring,13
evermore (deluxe version),willow,1,And there was one prize I'd cheat to win,14
evermore (deluxe version),willow,1,"The more that you say, the less I know",15
evermore (deluxe version),willow,1,"Wherever you stray, I follow",16
evermore (deluxe version),willow,1,I'm begging for you to take my hand,17
evermore (deluxe version),willow,1,"Wreck my plans, that's my man",18
evermore (deluxe version),willow,1,You know that my train could take you home,19
evermore (deluxe version),willow,1,Anywhere else is hollow,20
evermore (deluxe version),willow,1,I'm begging for you to take my hand,21
evermore (deluxe version),willow,1,"Wreck my plans, that's my man",22
evermore (deluxe version),willow,1,Life was a willow and it bent right to your wind,23
evermore (deluxe version),willow,1,They count me out time and time again,24
evermore (deluxe version),willow,1,Life was a willow and it bent right to your wind,25
evermore (deluxe version),willow,1,But I come back stronger than a '90s trend,26
evermore (deluxe version),willow,1,"Wait for the signal, and I'll meet you after dark",27
evermore (deluxe version),willow,1,Show me the places where the others gave you scars,28
evermore (deluxe version),willow,1,Now this is an open-shut case,29
evermore (deluxe version),willow,1,I guess I should've known from the look on your face,30
evermore (deluxe version),willow,1,Every bait-and-switch was a work of art,31
evermore (deluxe version),willow,1,"The more that you say, the less I know",32
evermore (deluxe version),willow,1,"Wherever you stray, I follow",33
evermore (deluxe version),willow,1,I'm begging for you to take my hand,34
evermore (deluxe version),willow,1,"Wreck my plans, that's my man",35
evermore (deluxe version),willow,1,You know that my train could take you home,36
evermore (deluxe version),willow,1,Anywhere else is hollow,37
evermore (deluxe version),willow,1,I'm begging for you to take my hand,38
evermore (deluxe version),willow,1,"Wreck my plans, that's my man",39
evermore (deluxe version),willow,1,"The more that you say, the less I know",40
evermore (deluxe version),willow,1,"Wherever you stray, I follow",41
evermore (deluxe version),willow,1,I'm begging for you to take my hand,42
evermore (deluxe version),willow,1,"Wreck my plans, that's my man",43
evermore (deluxe version),willow,1,You know that my train could take you home,44
evermore (deluxe version),willow,1,Anywhere else is hollow,45
evermore (deluxe version),willow,1,I'm begging for you to take my hand,46
evermore (deluxe version),willow,1,"Wreck my plans, that's my man",47
evermore (deluxe version),willow,1,"Hey, that's my man",48
evermore (deluxe version),willow,1,That's my man,49
evermore (deluxe version),willow,1,"Yeah, that's my man",50
evermore (deluxe version),willow,1,Every bait-and-switch was a work of art,51
evermore (deluxe version),willow,1,That's my man,52
evermore (deluxe version),willow,1,"Hey, that's my man",53
evermore (deluxe version),willow,1,I'm begging for you to take my hand,54
evermore (deluxe version),willow,1,"Wreck my plans, that's my man",55
evermore (deluxe version),champagne problems,2,You booked the night train for a reason,1
evermore (deluxe version),champagne problems,2,So you could sit there in this hurt,2
evermore (deluxe version),champagne problems,2,Bustling crowds or silent sleepers,3
evermore (deluxe version),champagne problems,2,You're not sure which is worse,4
evermore (deluxe version),champagne problems,2,Because I dropped your hand while dancing,5
evermore (deluxe version),champagne problems,2,Left you out there standing,6
evermore (deluxe version),champagne problems,2,Crestfallen on the landing,7
evermore (deluxe version),champagne problems,2,Champagne problems,8
evermore (deluxe version),champagne problems,2,Your mom's ring in your pocket,9
evermore (deluxe version),champagne problems,2,My picture in your wallet,10
evermore (deluxe version),champagne problems,2,"Your heart was glass, I dropped it",11
evermore (deluxe version),champagne problems,2,Champagne problems,12
evermore (deluxe version),champagne problems,2,You told your family for a reason,13
evermore (deluxe version),champagne problems,2,You couldn't keep it in,14
evermore (deluxe version),champagne problems,2,Your sister splashed out on the bottle,15
evermore (deluxe version),champagne problems,2,Now no one's celebrating,16
evermore (deluxe version),champagne problems,2,"Dom Pérignon, you brought it",17
evermore (deluxe version),champagne problems,2,No crowd of friends applauded,18
evermore (deluxe version),champagne problems,2,Your hometown skeptics called it,19
evermore (deluxe version),champagne problems,2,Champagne problems,20
evermore (deluxe version),champagne problems,2,"You had a speech, you're speechless",21
evermore (deluxe version),champagne problems,2,Love slipped beyond your reaches,22
evermore (deluxe version),champagne problems,2,And I couldn't give a reason,23
evermore (deluxe version),champagne problems,2,Champagne problems,24
evermore (deluxe version),champagne problems,2,Joeboy 'Sip (Alcohol)' Official Lyrics & Meaning | Verified,25
evermore (deluxe version),champagne problems,2,Your Midas touch on the Chevy door,26
evermore (deluxe version),champagne problems,2,November flush and your flannel cure,27
evermore (deluxe version),champagne problems,2,"""This dorm was once a madhouse""",28
evermore (deluxe version),champagne problems,2,"I made a joke, ""Well, it's made for me""",29
evermore (deluxe version),champagne problems,2,"How evergreen, our group of friends",30
evermore (deluxe version),champagne problems,2,Don't think we'll say that word again,31
evermore (deluxe version),champagne problems,2,And soon they'll have the nerve to deck the halls,32
evermore (deluxe version),champagne problems,2,That we once walked through,33
evermore (deluxe version),champagne problems,2,"One for the money, two for the show",34
evermore (deluxe version),champagne problems,2,I never was ready so I watch you go,35
evermore (deluxe version),champagne problems,2,Sometimes you just don't know the answer,36
evermore (deluxe version),champagne problems,2,'Til someone's on their knees and asks you,37
evermore (deluxe version),champagne problems,2,"""She would've made such a lovely bride",38
evermore (deluxe version),champagne problems,2,"What a shame she's fucked in the head,"" they said",39
evermore (deluxe version),champagne problems,2,But you'll find the real thing instead,40
evermore (deluxe version),champagne problems,2,She'll patch up your tapestry that I shred,41
evermore (deluxe version),champagne problems,2,And hold your hand while dancing,42
evermore (deluxe version),champagne problems,2,Never leave you standing,43
evermore (deluxe version),champagne problems,2,Crestfallen on the landing,44
evermore (deluxe version),champagne problems,2,With champagne problems,45
evermore (deluxe version),champagne problems,2,Your mom's ring in your pocket,46
evermore (deluxe version),champagne problems,2,Her picture in your wallet,47
evermore (deluxe version),champagne problems,2,You won't remember all my,48
evermore (deluxe version),champagne problems,2,Champagne problems,49
evermore (deluxe version),champagne problems,2,You won't remember all my,50
evermore (deluxe version),champagne problems,2,Champagne problems,51
evermore (deluxe version),​gold rush,3,"Gleaming, twinkling",1
evermore (deluxe version),​gold rush,3,Eyes like sinking ships on waters,2
evermore (deluxe version),​gold rush,3,"So inviting, I almost jump in",3
evermore (deluxe version),​gold rush,3,"But I don't like a gold rush, gold rush",4
evermore (deluxe version),​gold rush,3,I don't like anticipatin' my face in a red flush,5
evermore (deluxe version),​gold rush,3,I don't like that anyone would die to feel your touch,6
evermore (deluxe version),​gold rush,3,Everybody wants you,7
evermore (deluxe version),​gold rush,3,Everybody wonders what it would be like to love you,8
evermore (deluxe version),​gold rush,3,"Walk past, quick brush",9
evermore (deluxe version),​gold rush,3,"I don't like slow motion, double vision in rose blush",10
evermore (deluxe version),​gold rush,3,I don't like that falling feels like flying 'til the bone crush,11
evermore (deluxe version),​gold rush,3,Everybody wants you,12
evermore (deluxe version),​gold rush,3,But I don't like a gold rush,13
evermore (deluxe version),​gold rush,3,What must it be like to grow up that beautiful?,14
evermore (deluxe version),​gold rush,3,With your hair falling into place like dominoes,15
evermore (deluxe version),​gold rush,3,I see me padding across your wooden floors,16
evermore (deluxe version),​gold rush,3,With my Eagles t-shirt hanging from the door,17
evermore (deluxe version),​gold rush,3,"At dinner parties, I call you out on your contrarian shit",18
evermore (deluxe version),​gold rush,3,And the coastal town we wandered 'round had nеver seen a love as pure as it,19
evermore (deluxe version),​gold rush,3,And thеn it fades into the gray of my day-old tea,20
evermore (deluxe version),​gold rush,3,'Cause it could never be,21
evermore (deluxe version),​gold rush,3,"'Cause I don't like a gold rush, gold rush",22
evermore (deluxe version),​gold rush,3,I don't like anticipatin' my face in a red flush,23
evermore (deluxe version),​gold rush,3,I don't like that anyone would die to feel your touch,24
evermore (deluxe version),​gold rush,3,Everybody wants you,25
evermore (deluxe version),​gold rush,3,Everybody wonders what it would be like to love you,26
evermore (deluxe version),​gold rush,3,"Walk past, quick brush",27
evermore (deluxe version),​gold rush,3,"I don't like slow motion, double vision in rose blush",28
evermore (deluxe version),​gold rush,3,I don't like that falling feels like flying 'til the bone crush,29
evermore (deluxe version),​gold rush,3,Everybody wants you,30
evermore (deluxe version),​gold rush,3,But I don't like a gold rush,31
evermore (deluxe version),​gold rush,3,What must it be like to grow up that beautiful?,32
evermore (deluxe version),​gold rush,3,With your hair falling into place like dominoes,33
evermore (deluxe version),​gold rush,3,My mind turns your life into folklore,34
evermore (deluxe version),​gold rush,3,I can't dare to dream about you anymore,35
evermore (deluxe version),​gold rush,3,At dinner parties I won't call you out on your contrarian shit,36
evermore (deluxe version),​gold rush,3,And the coastal town we never found will never see a love as pure as it,37
evermore (deluxe version),​gold rush,3,'Cause it fades into the gray of my day-old tea,38
evermore (deluxe version),​gold rush,3,'Cause it will never be,39
evermore (deluxe version),​gold rush,3,"Gleaming, twinkling",40
evermore (deluxe version),​gold rush,3,Eyes like sinking ships on waters,41
evermore (deluxe version),​gold rush,3,"So inviting, I almost jump in",42
evermore (deluxe version),​’tis the damn season,4,If I wanted to know who you were hanging with,1
evermore (deluxe version),​’tis the damn season,4,"While I was gone, I would've asked you",2
evermore (deluxe version),​’tis the damn season,4,"It's the kind of cold, fogs up windshield glass",3
evermore (deluxe version),​’tis the damn season,4,But I felt it when I passed you,4
evermore (deluxe version),​’tis the damn season,4,"There's an ache in you, put there by the ache in me",5
evermore (deluxe version),​’tis the damn season,4,But if it's all the same to you,6
evermore (deluxe version),​’tis the damn season,4,It's the same to me,7
evermore (deluxe version),​’tis the damn season,4,So we could call it even,8
evermore (deluxe version),​’tis the damn season,4,"You could call me ""babe"" for the weekend",9
evermore (deluxe version),​’tis the damn season,4,"​'Tis the damn season, write this down",10
evermore (deluxe version),​’tis the damn season,4,I'm stayin' at my parents' house,11
evermore (deluxe version),​’tis the damn season,4,And the road not taken looks real good now,12
evermore (deluxe version),​’tis the damn season,4,And it always leads to you and my hometown,13
evermore (deluxe version),​’tis the damn season,4,I parkеd my car right between the Methodist,14
evermore (deluxe version),​’tis the damn season,4,And thе school that used to be ours,15
evermore (deluxe version),​’tis the damn season,4,The holidays linger like bad perfume,16
evermore (deluxe version),​’tis the damn season,4,"You can run, but only so far",17
evermore (deluxe version),​’tis the damn season,4,"I escaped it too, remember how you watched me leave",18
evermore (deluxe version),​’tis the damn season,4,"But if it's okay with you, it's okay with me",19
evermore (deluxe version),​’tis the damn season,4,We could call it even,20
evermore (deluxe version),​’tis the damn season,4,"You could call me ""babe"" for the weekend",21
evermore (deluxe version),​’tis the damn season,4,"​'Tis the damn season, write this down",22
evermore (deluxe version),​’tis the damn season,4,I'm stayin' at my parents' house,23
evermore (deluxe version),​’tis the damn season,4,And the road not taken looks real good now,24
evermore (deluxe version),​’tis the damn season,4,"Time flies, messy as the mud on your truck tires",25
evermore (deluxe version),​’tis the damn season,4,"Now I'm missing your smile, hear me out",26
evermore (deluxe version),​’tis the damn season,4,We could just ride around,27
evermore (deluxe version),​’tis the damn season,4,And the road not taken looks real good now,28
evermore (deluxe version),​’tis the damn season,4,And it always leads to you and my hometown,29
evermore (deluxe version),​’tis the damn season,4,Sleep in half the day just for old times' sake,30
evermore (deluxe version),​’tis the damn season,4,I won't ask you to wait if you don't ask me to stay,31
evermore (deluxe version),​’tis the damn season,4,So I'll go back to L.A. and the so-called friends,32
evermore (deluxe version),​’tis the damn season,4,Who'll write books about me if I ever make it,33
evermore (deluxe version),​’tis the damn season,4,And wonder about the only soul,34
evermore (deluxe version),​’tis the damn season,4,Who can tell which smiles I'm fakin',35
evermore (deluxe version),​’tis the damn season,4,And the heart I know I'm breakin' is my own,36
evermore (deluxe version),​’tis the damn season,4,To leave the warmest bed I've ever known,37
evermore (deluxe version),​’tis the damn season,4,We could call it even,38
evermore (deluxe version),​’tis the damn season,4,Even though I'm leaving,39
evermore (deluxe version),​’tis the damn season,4,And I'll be yours for the weekend,40
evermore (deluxe version),​’tis the damn season,4,​'Tis the damn season,41
evermore (deluxe version),​’tis the damn season,4,We could call it even,42
evermore (deluxe version),​’tis the damn season,4,"You could call me ""babe"" for the weekend",43
evermore (deluxe version),​’tis the damn season,4,"​'Tis the damn season, write this down",44
evermore (deluxe version),​’tis the damn season,4,I'm stayin' at my parents' house,45
evermore (deluxe version),​’tis the damn season,4,And the road not taken looks real good now,46
evermore (deluxe version),​’tis the damn season,4,"Time flies, messy as the mud on your truck tires",47
evermore (deluxe version),​’tis the damn season,4,"Now I'm missing your smile, hear me out",48
evermore (deluxe version),​’tis the damn season,4,We could just ride around,49
evermore (deluxe version),​’tis the damn season,4,And the road not taken looks real good now,50
evermore (deluxe version),​’tis the damn season,4,And it always leads to you and my hometown,51
evermore (deluxe version),​’tis the damn season,4,It always leads to you and my hometown,52
evermore (deluxe version),​tolerate it,5,I sit and watch you reading with your head low,1
evermore (deluxe version),​tolerate it,5,I wake and watch you breathing with your eyes closed,2
evermore (deluxe version),​tolerate it,5,I sit and watch you,3
evermore (deluxe version),​tolerate it,5,I notice everything you do or don't do,4
evermore (deluxe version),​tolerate it,5,"You're so much older and wiser, and I",5
evermore (deluxe version),​tolerate it,5,I wait by the door like I'm just a kid,6
evermore (deluxe version),​tolerate it,5,Use my best colors for your portrait,7
evermore (deluxe version),​tolerate it,5,Lay the table with the fancy shit,8
evermore (deluxe version),​tolerate it,5,And watch you tolerate it,9
evermore (deluxe version),​tolerate it,5,"If it's all in my head, tell me now",10
evermore (deluxe version),​tolerate it,5,Tell me I've got it wrong somehow,11
evermore (deluxe version),​tolerate it,5,I know my love should be celebrated,12
evermore (deluxe version),​tolerate it,5,But you tolerate it,13
evermore (deluxe version),​tolerate it,5,I greet you with a battle hero's welcome,14
evermore (deluxe version),​tolerate it,5,I take your indiscretions all in good fun,15
evermore (deluxe version),​tolerate it,5,"I sit and listеn, I polish plates until they gleam and glistеn",16
evermore (deluxe version),​tolerate it,5,You're so much older and wiser and I,17
evermore (deluxe version),​tolerate it,5,I wait by the door like I'm just a kid,18
evermore (deluxe version),​tolerate it,5,Use my best colors for your portrait,19
evermore (deluxe version),​tolerate it,5,Lay the table with the fancy shit,20
evermore (deluxe version),​tolerate it,5,And watch you tolerate it,21
evermore (deluxe version),​tolerate it,5,"If it's all in my head, tell me now",22
evermore (deluxe version),​tolerate it,5,Tell me I've got it wrong somehow,23
evermore (deluxe version),​tolerate it,5,I know my love should be celebrated,24
evermore (deluxe version),​tolerate it,5,But you tolerate it,25
evermore (deluxe version),​tolerate it,5,"While you were out building other worlds, where was I?",26
evermore (deluxe version),​tolerate it,5,Where's that man who'd throw blankets over my barbed wire?,27
evermore (deluxe version),​tolerate it,5,"I made you my temple, my mural, my sky",28
evermore (deluxe version),​tolerate it,5,Now I'm begging for footnotes in the story of your life,29
evermore (deluxe version),​tolerate it,5,Drawing hearts in the byline,30
evermore (deluxe version),​tolerate it,5,Always taking up too much space or time,31
evermore (deluxe version),​tolerate it,5,"You assume I'm fine, but what would you do if I",32
evermore (deluxe version),​tolerate it,5,Break free and leave us in ruins,33
evermore (deluxe version),​tolerate it,5,Took this dagger in me and removed it,34
evermore (deluxe version),​tolerate it,5,"Gain the weight of you, then lose it",35
evermore (deluxe version),​tolerate it,5,"Believe me, I could do it",36
evermore (deluxe version),​tolerate it,5,"If it's all in my head, tell me now",37
evermore (deluxe version),​tolerate it,5,Tell me I've got it wrong somehow,38
evermore (deluxe version),​tolerate it,5,I know my love should be celebrated,39
evermore (deluxe version),​tolerate it,5,But you tolerate it,40
evermore (deluxe version),​tolerate it,5,I sit and watch you,41
evermore (deluxe version),"​no body, no crime",6,He did it,1
evermore (deluxe version),"​no body, no crime",6,He did it,2
evermore (deluxe version),"​no body, no crime",6,Este's a friend of mine,3
evermore (deluxe version),"​no body, no crime",6,We meet up every Tuesday night for dinner and a glass of wine,4
evermore (deluxe version),"​no body, no crime",6,Este's been losin' sleep,5
evermore (deluxe version),"​no body, no crime",6,"Her husband's actin' different, and it smells like infidelity",6
evermore (deluxe version),"​no body, no crime",6,"She says, ""That ain't my Merlot on his mouth",7
evermore (deluxe version),"​no body, no crime",6,"That ain't my jewelry on our joint account""",8
evermore (deluxe version),"​no body, no crime",6,"No, there ain't no doubt",9
evermore (deluxe version),"​no body, no crime",6,I think I'm gonna call him out,10
evermore (deluxe version),"​no body, no crime",6,"She says, ""I think he did it, but I just can't prove it""",11
evermore (deluxe version),"​no body, no crime",6,"I think he did it, but I just can't prove it",12
evermore (deluxe version),"​no body, no crime",6,"I think he did it, but I just can't prove it",13
evermore (deluxe version),"​no body, no crime",6,"No, no body, no crime",14
evermore (deluxe version),"​no body, no crime",6,But I ain't lettin' up until the day I die,15
evermore (deluxe version),"​no body, no crime",6,"No, no",16
evermore (deluxe version),"​no body, no crime",6,I think he did it,17
evermore (deluxe version),"​no body, no crime",6,"No, no",18
evermore (deluxe version),"​no body, no crime",6,He did it,19
evermore (deluxe version),"​no body, no crime",6,Este wasn't there Tuesday night at Olive Gardеn,20
evermore (deluxe version),"​no body, no crime",6,At her job or anywhere,21
evermore (deluxe version),"​no body, no crime",6,Hе reports his missing wife,22
evermore (deluxe version),"​no body, no crime",6,And I noticed when I passed his house,23
evermore (deluxe version),"​no body, no crime",6,His truck has got some brand new tires,24
evermore (deluxe version),"​no body, no crime",6,And his mistress moved in,25
evermore (deluxe version),"​no body, no crime",6,Sleeps in Este's bed and everything,26
evermore (deluxe version),"​no body, no crime",6,"No, there ain't no doubt",27
evermore (deluxe version),"​no body, no crime",6,"Somebody's gotta catch him out, 'cause",28
evermore (deluxe version),"​no body, no crime",6,"I think he did it, but I just can't prove it (He did it)",29
evermore (deluxe version),"​no body, no crime",6,"I think he did it, but I just can't prove it (He did it)",30
evermore (deluxe version),"​no body, no crime",6,"I think he did it, but I just can't prove it",31
evermore (deluxe version),"​no body, no crime",6,"No, no body, no crime",32
evermore (deluxe version),"​no body, no crime",6,But I ain't lettin' up until the day I die,33
evermore (deluxe version),"​no body, no crime",6,"No, no",34
evermore (deluxe version),"​no body, no crime",6,I think he did it,35
evermore (deluxe version),"​no body, no crime",6,"No, no",36
evermore (deluxe version),"​no body, no crime",6,He did it,37
evermore (deluxe version),"​no body, no crime",6,Good thing my daddy made me get a boating license when I was fifteen,38
evermore (deluxe version),"​no body, no crime",6,And I've cleaned enough houses to know how to cover up a scene,39
evermore (deluxe version),"​no body, no crime",6,Good thing Este's sister's gonna swear she was with me,40
evermore (deluxe version),"​no body, no crime",6,"(She was with me, dude)",41
evermore (deluxe version),"​no body, no crime",6,Good thing his mistress took out a big life insurance policy,42
evermore (deluxe version),"​no body, no crime",6,"They think she did it, but they just can't prove it",43
evermore (deluxe version),"​no body, no crime",6,"They think she did it, but they just can't prove it",44
evermore (deluxe version),"​no body, no crime",6,"She thinks I did it, but she just can't prove it",45
evermore (deluxe version),"​no body, no crime",6,"No, no body, no crime",46
evermore (deluxe version),"​no body, no crime",6,I wasn't lettin' up until the day he—,47
evermore (deluxe version),"​no body, no crime",6,"No, no body, no crime",48
evermore (deluxe version),"​no body, no crime",6,I wasn't lettin' up until the day he—,49
evermore (deluxe version),"​no body, no crime",6,"No, no body, no crime",50
evermore (deluxe version),"​no body, no crime",6,I wasn't lettin' up until the day he died,51
evermore (deluxe version),​happiness,7,"Honey, when I'm above the trees",1
evermore (deluxe version),​happiness,7,I see this for what it is,2
evermore (deluxe version),​happiness,7,"But now I'm right down in it, all the years I've given",3
evermore (deluxe version),​happiness,7,Is just shit we're dividin' up,4
evermore (deluxe version),​happiness,7,Showed you all of my hiding spots,5
evermore (deluxe version),​happiness,7,I was dancing when the music stopped,6
evermore (deluxe version),​happiness,7,"And in the disbelief, I can't face reinvention",7
evermore (deluxe version),​happiness,7,I haven't met the new me yet,8
evermore (deluxe version),​happiness,7,There'll be happiness after you,9
